{
  "schema_version": 1,
  "job_id": "job_mock_paused",
  "project_id": "nh48",
  "source_video_path": "/data/projects/nh48/videos/2026-03-15_09-00.mp4",
  "video_stem": "2026-03-15_09-00",
  "current_frame": 18420,
  "total_frames": 90000,
  "counted_track_ids": [12, 45, 78, 102],
  "events_rows_written": 312,
  "manifest_path": "/data/viana-outputs/nh48/2026-03-15_09-00.manifest.json",
  "saved_at": "2026-03-15T10:42:18Z"
}
